{
  "schema": "witsoc.kernel-event.v1",
  "event_id": "event-example",
  "target_sha256": "0000000000000000000000000000000000000000000000000000000000000000",
  "base_revision": 0,
  "base_state_sha256": "0000000000000000000000000000000000000000000000000000000000000000",
  "kind": "DECISION_RECORD",
  "payload": {},
  "payload_sha256": "0000000000000000000000000000000000000000000000000000000000000000"
}
